{
  "schemaVersion": "v1",
  "chartType": "ei-kde",
  "state": "OR",
  "totalDistricts": 6,
  "metricLabel": "Support difference (Latino - non-Latino) for Hardy",
  "domain": [-0.5, 1.0],
  "thresholdX": 0.4,
  "thresholdLabel": "Prob(difference > 0.40)",
  "thresholdProbability": 0.73,
  "series": [
    { "key": "latino", "label": "Latino", "points": [
      { "x": 0.10, "density": 0.3 }, { "x": 0.20, "density": 0.7 }, { "x": 0.30, "density": 1.5 }, { "x": 0.40, "density": 2.6 }, { "x": 0.50, "density": 3.1 }, { "x": 0.60, "density": 2.4 }, { "x": 0.70, "density": 1.2 }, { "x": 0.80, "density": 0.4 }
    ]},
    { "key": "non_latino", "label": "Non-Latino", "points": [
      { "x": -0.10, "density": 0.2 }, { "x": 0.00, "density": 0.8 }, { "x": 0.10, "density": 1.9 }, { "x": 0.20, "density": 2.4 }, { "x": 0.30, "density": 1.4 }, { "x": 0.40, "density": 0.5 }
    ]}
  ]
}
